{"dependencies":[{"installed_version":"1.0.0","node_key":"s02-helper-a","package_name":"fixture-helper-s02-a"},{"installed_version":"1.0.0","node_key":"s02-helper-b","package_name":"fixture-helper-s02-b"},{"installed_version":"1.0.0","node_key":"s02-helper-c","package_name":"fixture-helper-s02-c"},{"installed_version":"2.2.0","node_key":"s02-jsonata","package_name":"jsonata"}],"dependency_edges":[{"child_node_key":"s02-jsonata","parent_node_key":"s02-helper-a","requirement":"^2.2.0"},{"child_node_key":"s02-jsonata","parent_node_key":"s02-helper-b","requirement":"^2.2.0"},{"child_node_key":"s02-jsonata","parent_node_key":"s02-helper-c","requirement":"^2.2.0"}],"ecosystem":"npm","family_id":"family-s02","finding_facts":[{"manifest_evidence":[],"node_key":"s02-jsonata","reachability":"unknown"}],"fixture_id":"dp-sealed-02","generator_seed":"seed-s02","graph_template_id":"graph-s02","release_inventories":[{"package_name":"jsonata","releases":[]}],"root":{"installed_version":"1.0.0","node_key":"s02-root","package_name":"fixture-root-s02"},"root_dependencies":[{"child_node_key":"s02-helper-a","requirement":"1.0.0","runtime_scope":"development_only"},{"child_node_key":"s02-helper-b","requirement":"1.0.0","runtime_scope":"development_only"},{"child_node_key":"s02-helper-c","requirement":"1.0.0","runtime_scope":"development_only"}],"schema_version":1,"split":"sealed"}
