{"dependencies":[{"installed_version":"2.31.0","node_key":"d06-requests","package_name":"requests"},{"installed_version":"1.26.17","node_key":"d06-urllib3","package_name":"urllib3"}],"dependency_edges":[{"child_node_key":"d06-urllib3","parent_node_key":"d06-requests","requirement":">=1.21.1,<2"}],"ecosystem":"pypi","family_id":"family-d06","finding_facts":[{"manifest_evidence":[],"node_key":"d06-requests","reachability":"unknown"},{"manifest_evidence":[],"node_key":"d06-urllib3","reachability":"reachable"}],"fixture_id":"dp-development-06","generator_seed":"seed-d06","graph_template_id":"graph-d06","release_inventories":[{"package_name":"requests","releases":[]},{"package_name":"urllib3","releases":[]}],"root":{"installed_version":"1.0.0","node_key":"d06-root","package_name":"fixture-root-d06"},"root_dependencies":[{"child_node_key":"d06-requests","requirement":">=2.31,<3","runtime_scope":"production"}],"schema_version":1,"split":"development"}
