{"dependencies":[{"installed_version":"1.0.0","node_key":"s06-helper-a","package_name":"fixture-helper-s06-a"},{"installed_version":"1.0.0","node_key":"s06-helper-b","package_name":"fixture-helper-s06-b"},{"installed_version":"1.0.0","node_key":"s06-helper-c","package_name":"fixture-helper-s06-c"},{"installed_version":"0.0.235","node_key":"s06-langchain","package_name":"langchain"}],"dependency_edges":[{"child_node_key":"s06-langchain","parent_node_key":"s06-helper-a","requirement":"==0.0.235"},{"child_node_key":"s06-langchain","parent_node_key":"s06-helper-b","requirement":"==0.0.235"},{"child_node_key":"s06-langchain","parent_node_key":"s06-helper-c","requirement":"==0.0.235"}],"ecosystem":"pypi","family_id":"family-s06","finding_facts":[{"manifest_evidence":[],"node_key":"s06-langchain","reachability":"reachable"}],"fixture_id":"dp-sealed-06","generator_seed":"seed-s06","graph_template_id":"graph-s06","release_inventories":[{"package_name":"langchain","releases":[]}],"root":{"installed_version":"1.0.0","node_key":"s06-root","package_name":"fixture-root-s06"},"root_dependencies":[{"child_node_key":"s06-helper-a","requirement":"==1.0.0","runtime_scope":"production"},{"child_node_key":"s06-helper-b","requirement":"==1.0.0","runtime_scope":"production"},{"child_node_key":"s06-helper-c","requirement":"==1.0.0","runtime_scope":"production"}],"schema_version":1,"split":"sealed"}
