{"dependencies":[{"installed_version":"3.0.3","node_key":"r02-form3","package_name":"form-data"},{"installed_version":"2.5.4","node_key":"r02-form2","package_name":"form-data"}],"dependency_edges":[],"ecosystem":"npm","family_id":"family-r02","finding_facts":[{"manifest_evidence":[],"node_key":"r02-form3","reachability":"reachable"},{"manifest_evidence":[],"node_key":"r02-form2","reachability":"reachable"}],"fixture_id":"dp-regression-02","generator_seed":"seed-r02","graph_template_id":"graph-r02","release_inventories":[{"package_name":"form-data","releases":[]}],"root":{"installed_version":"1.0.0","node_key":"r02-root","package_name":"fixture-root-r02"},"root_dependencies":[{"child_node_key":"r02-form3","requirement":"^3.0.0","runtime_scope":"production"},{"child_node_key":"r02-form2","requirement":"2.5.4","runtime_scope":"development_only"}],"schema_version":1,"split":"regression"}
