{"dependencies":[{"installed_version":"1.0.0","node_key":"d04-adapter","package_name":"fixture-helper-d04"},{"installed_version":"3.0.2","node_key":"d04-braces","package_name":"braces"}],"dependency_edges":[{"child_node_key":"d04-braces","parent_node_key":"d04-adapter","requirement":"^3.0.0"}],"ecosystem":"npm","family_id":"family-d04","finding_facts":[{"manifest_evidence":[],"node_key":"d04-braces","reachability":"unknown"}],"fixture_id":"dp-development-04","generator_seed":"seed-d04","graph_template_id":"graph-d04","release_inventories":[{"package_name":"braces","releases":[]}],"root":{"installed_version":"1.0.0","node_key":"d04-root","package_name":"fixture-root-d04"},"root_dependencies":[{"child_node_key":"d04-adapter","requirement":"1.0.0","runtime_scope":"development_only"}],"schema_version":1,"split":"development"}
