{"dependencies":[{"installed_version":"3.3.0","node_key":"s03-crypto3","package_name":"crypto-js"},{"installed_version":"4.0.0","node_key":"s03-crypto4","package_name":"crypto-js"},{"installed_version":"1.0.0","node_key":"s03-helper","package_name":"fixture-helper-s03"}],"dependency_edges":[{"child_node_key":"s03-crypto3","parent_node_key":"s03-helper","requirement":"^3.3.0"}],"ecosystem":"npm","family_id":"family-s03","finding_facts":[{"manifest_evidence":[],"node_key":"s03-crypto3","reachability":"unreachable"},{"manifest_evidence":[],"node_key":"s03-crypto4","reachability":"reachable"}],"fixture_id":"dp-sealed-03","generator_seed":"seed-s03","graph_template_id":"graph-s03","release_inventories":[{"package_name":"crypto-js","releases":[]}],"root":{"installed_version":"1.0.0","node_key":"s03-root","package_name":"fixture-root-s03"},"root_dependencies":[{"child_node_key":"s03-helper","requirement":"1.0.0","runtime_scope":"development_only"},{"child_node_key":"s03-crypto4","requirement":"4.0.0","runtime_scope":"production"}],"schema_version":1,"split":"sealed"}
