{"dependencies":[{"installed_version":"4.1.3","node_key":"d03-tough","package_name":"tough-cookie"}],"dependency_edges":[],"ecosystem":"npm","family_id":"family-d03","finding_facts":[{"manifest_evidence":[],"node_key":"d03-tough","reachability":"reachable"}],"fixture_id":"dp-development-03","generator_seed":"seed-d03","graph_template_id":"graph-d03","release_inventories":[{"package_name":"tough-cookie","releases":[]}],"root":{"installed_version":"1.0.0","node_key":"d03-root","package_name":"fixture-root-d03"},"root_dependencies":[{"child_node_key":"d03-tough","requirement":"^4.1.0","runtime_scope":"production"}],"schema_version":1,"split":"development"}
