{"dependencies":[{"installed_version":"69.5.1","node_key":"d09-setuptools","package_name":"setuptools"}],"dependency_edges":[],"ecosystem":"pypi","family_id":"family-d09","finding_facts":[{"manifest_evidence":[],"node_key":"d09-setuptools","reachability":"unknown"}],"fixture_id":"dp-development-09","generator_seed":"seed-d09","graph_template_id":"graph-d09","release_inventories":[{"package_name":"setuptools","releases":[]}],"root":{"installed_version":"1.0.0","node_key":"d09-root","package_name":"fixture-root-d09"},"root_dependencies":[{"child_node_key":"d09-setuptools","requirement":">=69,<70","runtime_scope":"development_only"}],"schema_version":1,"split":"development"}
