{"dependencies":[{"installed_version":"1.0.0","node_key":"d08-adapter","package_name":"fixture-helper-d08"},{"installed_version":"41.0.5","node_key":"d08-crypto","package_name":"cryptography"}],"dependency_edges":[{"child_node_key":"d08-crypto","parent_node_key":"d08-adapter","requirement":"==41.0.5"}],"ecosystem":"pypi","family_id":"family-d08","finding_facts":[{"manifest_evidence":[],"node_key":"d08-crypto","reachability":"unreachable"}],"fixture_id":"dp-development-08","generator_seed":"seed-d08","graph_template_id":"graph-d08","release_inventories":[{"package_name":"cryptography","releases":[]}],"root":{"installed_version":"1.0.0","node_key":"d08-root","package_name":"fixture-root-d08"},"root_dependencies":[{"child_node_key":"d08-adapter","requirement":"==1.0.0","runtime_scope":"production"}],"schema_version":1,"split":"development"}
