{"dependencies":[{"installed_version":"10.0.1","node_key":"d07-pillow","package_name":"pillow"}],"dependency_edges":[],"ecosystem":"pypi","family_id":"family-d07","finding_facts":[{"manifest_evidence":[],"node_key":"d07-pillow","reachability":"reachable"}],"fixture_id":"dp-development-07","generator_seed":"seed-d07","graph_template_id":"graph-d07","release_inventories":[{"package_name":"pillow","releases":[]}],"root":{"installed_version":"1.0.0","node_key":"d07-root","package_name":"fixture-root-d07"},"root_dependencies":[{"child_node_key":"d07-pillow","requirement":">=10,<11","runtime_scope":"production"}],"schema_version":1,"split":"development"}
